{
  "schema_version": "0.3.0",
  "artifact_type": "graph_query",
  "artifact_id": "graph_query_demo_001",
  "run_id": "run_demo_001",
  "iteration": 0,
  "producer": "access_analyzer",
  "mode": "development",
  "created_at": "2026-10-06T00:01:00Z",
  "status": "completed",
  "input_refs": [],
  "errors": [],
  "runtime_metrics": null,
  "data": {
    "graph_id": "graph_demo_001",
    "expected_graph_revision": 1,
    "queries": [
      {"query_id": "query_ownership", "query_key": "resource_ownership", "parameters": {"account_ids": [], "resource_ids": []}},
      {"query_id": "query_access", "query_key": "role_resource_access", "parameters": {"role_ids": []}},
      {"query_id": "query_flow", "query_key": "workflow_dependencies", "parameters": {"workflow_ids": []}},
      {"query_id": "query_snapshot", "query_key": "structure_snapshot", "parameters": {"include_evidence_refs": true}}
    ]
  }
}
